term,slug,cluster,status,priority,keywords
What is Zero Shot Prompting,what-is-zero-shot-prompting,prompt-engineering,done,1,zero shot prompting
What is Zipf Law in AI,what-is-zipf-law-in-ai,ai-basics,pending,2,"Zipf law, frequency distribution, power law, word frequency, NLP phenomenon"
What is Zapier AI,what-is-zapier-ai,ai-tools,pending,2,"Zapier AI, AI automation, workflow automation, no-code AI, Zapier Central"
What is Zero-Shot Generalization,what-is-zero-shot-generalization,ai-research,pending,2,"zero-shot generalization, generalization, unseen task, transfer, new task"
What is Zero-Shot Image Classification,what-is-zero-shot-image-classification,ai-multimodal,pending,2,"zero-shot image, image classification, open-vocabulary, unseen classes, CLIP"
What is Zephyr,what-is-zephyr,llms,pending,2,"Zephyr, Hugging Face, LLM, fine-tuned, instruction"
What is ZeroGPT,what-is-zerogpt,ai-tools,pending,2,"ZeroGPT, AI detection, GPT, checker, plagiarism"
What is Zero-Shot Classification,what-is-zero-shot-classification,ai-basics,pending,2,"zero-shot classification, unseen classes, transfer learning, nlp"
