term,slug,cluster,status,priority,keywords
What is Query in AI,what-is-query-in-ai,ai-infrastructure,pending,2,query in ai
What is Quantization in LLM,what-is-quantization-in-llm,llms,pending,2,"quantization, model quantization, precision reduction, compression, efficient inference"
What is Qdrant,what-is-qdrant,ai-infrastructure,pending,2,"Qdrant, vector database, vector search, similarity search, Qdrant DB"
What is Qwen2-VL,what-is-qwen2-vl,ai-multimodal,pending,2,"Qwen2-VL, Alibaba vision, multimodal model, video understanding, image AI"
What is Qwen QwQ,what-is-qwen-qwq,llms,pending,2,"Qwen, QwQ, reasoning, Alibaba, open-source"
What is Qwen2.5 Coder,what-is-qwen2-5-coder,llms,pending,2,"Qwen2.5, Coder, Alibaba, code, SLM"
What is Quora Poe,what-is-quora-poe,ai-tools,pending,2,"Quora, Poe, AI, chatbot, multi-model"
What is Query Rewriting,what-is-query-rewriting,ai-infrastructure,pending,2,"query rewriting, query optimization, search, nlp"
What is Question Answering System,what-is-question-answering-system,ai-basics,pending,2,"question answering, qa system, natural language understanding, nlp"
What is Query Understanding,what-is-query-understanding,ai-basics,pending,2,"query understanding, intent parsing, search intent, nlp"
What is Query Expansion,what-is-query-expansion,ai-basics,pending,2,"query expansion, query refinement, search enhancement, information retrieval"
What is Question Decomposition,what-is-question-decomposition,ai-basics,pending,2,"question decomposition, multi-part query, subquestion, reasoning"
What is Quality Assurance in AI,what-is-quality-assurance-in-ai,ai-safety,pending,2,"quality assurance, testing, validation, reliability"
What is Qwen MoE,what-is-qwen-moe,llms,pending,2,"Qwen MoE, Qwen mixture of experts, Qwen architecture, Qwen sparse model, Qwen expert model"
What is Qwen LLM,what-is-qwen-llm,llms,pending,2,"Qwen LLM, Alibaba Qwen, Qwen large language model, Qwen series, Qwen foundation model"
What is QuIP,what-is-quip,llms,pending,2,"QuIP, quantization with incoherence processing, lattice quantization, optimal quantization, coherent quantization"
What is QLoRA,what-is-qlora,llms,pending,2,"QLoRA, quantized LoRA, low-rank quantized adaptation, memory efficient LoRA, 4-bit LoRA"
