term,slug,cluster,status,priority,keywords
What is AI Architecture Design,what-is-ai-architecture-design,ai-creative,pending,2,"AI architecture, building design, architectural AI, design generation, structure AI"
What is AI Game Art,what-is-ai-game-art,ai-creative,pending,2,"AI game art, game graphics, game asset, art generation, game AI art"
What is AI Asset Generation,what-is-ai-asset-generation,ai-creative,pending,2,"asset generation, AI assets, game assets, digital assets, content generation"
What is AI Brand Design,what-is-ai-brand-design,ai-creative,pending,2,"AI branding, brand AI, brand identity, logo brand, design system"
What is Autonomous Navigation,what-is-autonomous-navigation,ai-robotics,pending,2,"autonomous navigation, self-navigation, robot path, mobile robot, navigation AI"
What is AI Strategy,what-is-ai-strategy,ai-business,pending,2,"AI strategy, AI plan, AI roadmap, AI approach, business strategy"
What is AI Transformation,what-is-ai-transformation,ai-business,pending,2,"AI transformation, digital transformation, AI change, business transformation, AI adoption"
What is AI Adoption,what-is-ai-adoption,ai-business,pending,2,"AI adoption, adopt AI, AI implementation, AI integration, use AI"
What is AI ROI,what-is-ai-roi,ai-business,pending,2,"AI ROI, return on investment, AI value, AI cost, AI benefit"
What is AI Use Case,what-is-ai-use-case,ai-business,pending,2,"AI use case, AI application, business use, AI scenario, AI example"
What is AI Product Development,what-is-ai-product-development,ai-business,pending,2,"AI product, product development, AI feature, product AI, build AI"
What is AI Maturity Model,what-is-ai-maturity-model,ai-business,pending,2,"AI maturity, AI readiness, maturity model, AI capability, AI stage"
What is AI Governance in Business,what-is-ai-governance-in-business,ai-business,pending,2,"AI governance, business governance, AI oversight, AI management, governance framework"
What is AI Policy,what-is-ai-policy,ai-business,pending,2,"AI policy, company policy, AI rules, AI guidelines, internal policy"
What is AI Ethics Program,what-is-ai-ethics-program,ai-business,pending,2,"AI ethics program, ethics initiative, responsible program, ethics framework, AI values"
What is AI Training for Employees,what-is-ai-training-for-employees,ai-business,pending,2,"AI training, employee training, AI skills, workforce training, AI education"
What is AI Change Management,what-is-ai-change-management,ai-business,pending,2,"change management, AI change, organizational change, AI transition, change process"
What is AI Pilot Project,what-is-ai-pilot-project,ai-business,pending,2,"AI pilot, pilot project, AI trial, proof of concept, AI experiment"
What is AI Scale-Up,what-is-ai-scale-up,ai-business,pending,2,"AI scale, scaling AI, AI growth, expand AI, AI at scale"
What is AI Vendor,what-is-ai-vendor,ai-business,pending,2,"AI vendor, AI provider, AI supplier, AI platform, technology vendor"
What is AI Consulting,what-is-ai-consulting,ai-business,pending,2,"AI consulting, AI advisory, AI consultant, AI services, AI expert"
What is AI Outsourcing,what-is-ai-outsourcing,ai-business,pending,2,"AI outsourcing, outsource AI, AI services, external AI, AI partner"
What is AI Risk Management,what-is-ai-risk-management,ai-business,pending,2,"AI risk, risk management, AI risk framework, business risk, AI uncertainty"
What is AI Competitive Advantage,what-is-ai-competitive-advantage,ai-business,pending,2,"AI advantage, competitive edge, AI differentiator, business advantage, AI strategy"
What is AI-Driven Marketing,what-is-ai-driven-marketing,ai-business,pending,2,"AI marketing, AI-driven marketing, marketing automation, personalized marketing, martech"
What is AI Sales Tool,what-is-ai-sales-tool,ai-business,pending,2,"AI sales, sales tool, sales AI, revenue AI, sales automation"
What is AI Customer Insights,what-is-ai-customer-insights,ai-business,pending,2,"customer insights, AI analytics, customer data, customer intelligence, insight AI"
What is AI Churn Prediction,what-is-ai-churn-prediction,ai-business,pending,2,"churn prediction, customer churn, retention AI, churn model, customer loss"
What is AI Lead Scoring,what-is-ai-lead-scoring,ai-business,pending,2,"lead scoring, AI leads, sales lead, lead ranking, prospect scoring"
What is AI Personalization,what-is-ai-personalization,ai-business,pending,2,"AI personalization, personalization, personalized experience, customization, tailored AI"
What is AI Recommendation,what-is-ai-recommendation,ai-business,pending,2,"AI recommendation, recommendation system, recommender, suggest AI, product recommendation"
What is AI Dynamic Pricing,what-is-ai-dynamic-pricing,ai-business,pending,2,"dynamic pricing, AI pricing, price optimization, demand pricing, real-time pricing"
What is AI Fraud Detection,what-is-ai-fraud-detection,ai-business,pending,2,"fraud detection, AI fraud, fraud prevention, financial fraud, scam detection"
What is AI Research,what-is-ai-research,ai-research,pending,2,"AI research, research AI, AI science, AI discovery, AI progress"
What is Attention Is All You Need,what-is-attention-is-all-you-need,ai-research,pending,2,"attention is all you need, transformer paper, Google paper, original transformer, landmark paper"
What is AI Data Strategy,what-is-ai-data-strategy,ai-data,pending,2,"AI data, data strategy, data for AI, data planning, data approach"
What is AI Tutoring,what-is-ai-tutoring,ai-education,pending,2,"AI tutor, AI tutoring, personalized learning, adaptive learning, AI education"
What is AI Course,what-is-ai-course,ai-education,pending,2,"AI course, online AI, learn AI, AI class, AI training"
What is AI Learning Platform,what-is-ai-learning-platform,ai-education,pending,2,"AI learning, learning platform, AI education, online learning, e-learning AI"
What is AI Curriculum,what-is-ai-curriculum,ai-education,pending,2,"AI curriculum, AI syllabus, AI education, AI program, study AI"
What is AI Certification,what-is-ai-certification,ai-education,pending,2,"AI certification, AI certificate, AI credential, AI qualification, AI course"
What is AI Research Paper,what-is-ai-research-paper,ai-education,pending,2,"AI research, research paper, AI publication, academic AI, paper reading"
What is AI Book,what-is-ai-book,ai-education,pending,2,"AI book, AI reading, AI literature, book AI, learn from books"
What is AI Community,what-is-ai-community,ai-education,pending,2,"AI community, AI group, AI forum, AI network, AI society"
What is AI Conference,what-is-ai-conference,ai-education,pending,2,"AI conference, NeurIPS, ICML, AI summit, AI event"
What is AI Hackathon,what-is-ai-hackathon,ai-education,pending,2,"AI hackathon, AI competition, AI challenge, build AI, code event"
What is AI Career,what-is-ai-career,ai-education,pending,2,"AI career, AI job, AI profession, work in AI, AI employment"
What is AI Skills,what-is-ai-skills,ai-education,pending,2,"AI skills, AI competence, AI ability, AI expertise, learn skills"
What is AI Bootcamp,what-is-ai-bootcamp,ai-education,pending,2,"AI bootcamp, AI intensive, AI training program, learn fast, AI workshop"
What is AI University Program,what-is-ai-university-program,ai-education,pending,2,"AI university, AI degree, AI program, AI major, study degree"
What is AI for Kids,what-is-ai-for-kids,ai-education,pending,2,"AI kids, AI children, AI for beginners, young AI, AI education kids"
What is AI Diagnosis,what-is-ai-diagnosis,ai-healthcare,pending,2,"AI diagnosis, medical diagnosis, AI doctor, diagnostic AI, disease detection"
What is AI Drug Discovery,what-is-ai-drug-discovery,ai-healthcare,pending,2,"AI drug discovery, drug development, pharmaceutical AI, medicine discovery, drug research"
What is AI Medical Imaging,what-is-ai-medical-imaging,ai-healthcare,pending,2,"AI medical imaging, medical scan, radiology AI, image diagnosis, MRI AI"
What is AI Radiology,what-is-ai-radiology,ai-healthcare,pending,2,"AI radiology, radiology AI, X-ray AI, CT scan, radiologist AI"
What is AI Pathology,what-is-ai-pathology,ai-healthcare,pending,2,"AI pathology, pathology AI, tissue analysis, digital pathology, disease detection"
What is AI Genomics,what-is-ai-genomics,ai-healthcare,pending,2,"AI genomics, genomic AI, DNA analysis, gene sequencing, genetic AI"
What is AI Clinical Trial,what-is-ai-clinical-trial,ai-healthcare,pending,2,"AI clinical trial, clinical research, trial optimization, patient matching, drug trial"
What is AI Mental Health,what-is-ai-mental-health,ai-healthcare,pending,2,"AI mental health, mental health AI, therapy AI, wellness AI, counseling"
What is AI Health Monitoring,what-is-ai-health-monitoring,ai-healthcare,pending,2,"AI health monitor, health tracking, vital monitoring, wearable AI, health sensor"
What is AI Telemedicine,what-is-ai-telemedicine,ai-healthcare,pending,2,"AI telemedicine, telehealth, remote care, virtual health, online doctor"
What is AI Epidemiology,what-is-ai-epidemiology,ai-healthcare,pending,2,"AI epidemiology, disease spread, outbreak prediction, public health, epidemic AI"
What is AI Surgery,what-is-ai-surgery,ai-healthcare,pending,2,"AI surgery, surgical robot, robotic surgery, AI surgeon, assisted surgery"
What is AI Trading,what-is-ai-trading,ai-finance,pending,2,"AI trading, algorithmic trading, automated trading, stock AI, trade AI"
What is AI Investing,what-is-ai-investing,ai-finance,pending,2,"AI investing, investment AI, robo advisor, portfolio AI, smart investing"
What is AI Risk Assessment in Finance,what-is-ai-risk-assessment-in-finance,ai-finance,pending,2,"AI risk, financial risk, credit risk, risk assessment, risk analysis"
What is AI Credit Scoring,what-is-ai-credit-scoring,ai-finance,pending,2,"AI credit, credit score, credit scoring, loan AI, credit assessment"
What is AI Loan Approval,what-is-ai-loan-approval,ai-finance,pending,2,"AI loan, loan approval, lending AI, loan decision, credit decision"
What is AI Underwriting,what-is-ai-underwriting,ai-finance,pending,2,"AI underwriting, underwriting, insurance AI, risk underwriting, policy AI"
What is AI Anti-Money Laundering,what-is-ai-anti-money-laundering,ai-finance,pending,2,"AML, anti-money laundering, financial crime, AI compliance, transaction monitoring"
What is AI Financial Planning,what-is-ai-financial-planning,ai-finance,pending,2,"AI financial planning, financial AI, budget AI, wealth management, finance advisor"
What is AI Accounting,what-is-ai-accounting,ai-finance,pending,2,"AI accounting, accounting AI, bookkeeping, automated accounting, finance automation"
What is AI Invoice Processing,what-is-ai-invoice-processing,ai-finance,pending,2,"AI invoice, invoice processing, billing AI, payment AI, invoice automation"
What is AI Expense Management,what-is-ai-expense-management,ai-finance,pending,2,"AI expense, expense management, spend AI, cost tracking, budget AI"
What is AI Portfolio Management,what-is-ai-portfolio-management,ai-finance,pending,2,"AI portfolio, portfolio management, investment portfolio, asset management, robo advisor"
What is AI Regulatory Compliance,what-is-ai-regulatory-compliance,ai-finance,pending,2,"AI regulatory, compliance AI, regulation tech, regtech, financial compliance"
What is AI in Game Development,what-is-ai-in-game-development,ai-gaming,pending,2,"game development AI, game dev, AI game, development tool, game creation"
What is AI NPC,what-is-ai-npc,ai-gaming,pending,2,"AI NPC, non-player character, game character, intelligent NPC, game AI"
What is AI Procedural Generation,what-is-ai-procedural-generation,ai-gaming,pending,2,"procedural generation, AI content, level generation, world building, auto content"
What is AI Game Testing,what-is-ai-game-testing,ai-gaming,pending,2,"AI game test, game testing, bug detection, play testing, QA AI"
What is AI Opponent,what-is-ai-opponent,ai-gaming,pending,2,"AI opponent, game enemy, computer player, AI challenge, bot opponent"
What is AI Storytelling in Games,what-is-ai-storytelling-in-games,ai-gaming,pending,2,"AI storytelling, narrative AI, game story, dynamic story, interactive narrative"
What is AI Voice in Games,what-is-ai-voice-in-games,ai-gaming,pending,2,"AI voice game, game dialogue, voice acting, AI character voice, speech in game"
What is AI Game Balance,what-is-ai-game-balance,ai-gaming,pending,2,"game balance, AI balance, difficulty adjustment, fair play, adaptive difficulty"
What is AI Esports,what-is-ai-esports,ai-gaming,pending,2,"AI esports, esports AI, competitive gaming, game analysis, esports analytics"
What is AI Game Recommendation,what-is-ai-game-recommendation,ai-gaming,pending,2,"game recommendation, suggest game, AI game pick, personalized game, game discovery"
