term,slug,cluster,status,priority,keywords
What is an AI Agent,what-is-an-ai-agent,ai-agents,done,1,"AI agent, autonomous AI, AI assistant, intelligent agent, AI automation"
What is Attention Mechanism,what-is-attention-mechanism,llms,done,1,"attention mechanism, transformer model, neural network, AI attention, self-attention"
What is Accuracy in AI,what-is-accuracy-in-ai,ai-basics,done,1,"AI accuracy, model accuracy, machine learning accuracy, AI performance, prediction accuracy"
What is Activation Function,what-is-activation-function,ai-basics,done,1,"activation function, neural network, ReLU, sigmoid, deep learning"
What is AI Safety,what-is-ai-safety,ai-basics,done,1,"AI safety, responsible AI, AI risk, AI alignment, safe AI"
What is AI Alignment,what-is-ai-alignment,ai-basics,done,1,"AI alignment, value alignment, AI safety, AI ethics, superintelligence"
What is AGI,what-is-agi,ai-basics,failed,1,"AGI, artificial general intelligence, human-level AI, strong AI, superintelligence"
What is AI Ethics,what-is-ai-ethics,ai-basics,done,1,"AI ethics, ethical AI, responsible AI, AI bias, AI morality"
What is AI Governance,what-is-ai-governance,ai-basics,failed,2,"AI governance, AI regulation, AI policy, AI oversight, AI compliance"
What is AI Image Generation,what-is-ai-image-generation,ai-tools,failed,1,"AI image generation, text-to-image, generative AI, DALL-E, Midjourney"
What is AI Video Generation,what-is-ai-video-generation,ai-tools,failed,1,"AI video generation, text-to-video, generative AI, Sora, AI video maker"
What is AI Music Generation,what-is-ai-music-generation,ai-tools,done,2,"AI music generation, AI music, text-to-music, generative AI, AI composer"
What is AI Code Generation,what-is-ai-code-generation,ai-tools,done,1,"AI code generation, AI coding, GitHub Copilot, code assistant, AI programming"
What is AI Writing Assistant,what-is-ai-writing-assistant,ai-tools,done,1,"AI writing assistant, AI writer, content generator, AI copywriting, ChatGPT writing"
What is AI Chatbot,what-is-ai-chatbot,ai-tools,done,1,"AI chatbot, conversational AI, ChatGPT, virtual assistant, AI chat"
What is Alexa AI,what-is-alexa-ai,ai-tools,done,2,"Alexa, Amazon Alexa, voice assistant, smart speaker, AI assistant"
What is AutoGPT,what-is-autogpt,ai-agents,done,1,"AutoGPT, autonomous AI agent, GPT-4, AI automation, self-prompting AI"
What is AI Workflow Automation,what-is-ai-workflow-automation,ai-agents,failed,1,"AI workflow automation, AI automation, workflow AI, business automation, intelligent automation"
What is AI Orchestration,what-is-ai-orchestration,ai-agents,failed,2,"AI orchestration, AI workflow, multi-agent AI, AI pipeline, agent orchestration"
What is Agentic AI,what-is-agentic-ai,ai-agents,failed,1,"agentic AI, AI agent, autonomous AI, AI action, proactive AI"
What is AI Memory,what-is-ai-memory,ai-agents,done,1,"AI memory, AI context, conversational memory, long-term memory AI, AI recall"
What is AI Planning,what-is-ai-planning,ai-agents,done,2,"AI planning, AI task planning, autonomous planning, AI reasoning, AI goal setting"
What is AI API,what-is-ai-api,ai-infrastructure,done,1,"AI API, OpenAI API, AI integration, API access, AI developer tools"
What is AI Model,what-is-ai-model,ai-basics,done,1,"AI model, machine learning model, neural network, foundation model, trained model"
What is AI Benchmark,what-is-ai-benchmark,ai-basics,done,2,"AI benchmark, model evaluation, AI performance, benchmark test, LLM benchmark"
What is AI Pipeline,what-is-ai-pipeline,ai-infrastructure,done,2,"AI pipeline, data pipeline, ML pipeline, AI workflow, data processing"
What is AI Monitoring,what-is-ai-monitoring,ai-infrastructure,done,2,"AI monitoring, model monitoring, AI observability, ML monitoring, AI performance tracking"
What is AI Guardrails,what-is-ai-guardrails,ai-safety,done,1,"AI guardrails, AI safety, content filtering, AI boundaries, responsible AI"
What is AI Watermarking,what-is-ai-watermarking,ai-safety,done,2,"AI watermarking, digital watermark, AI content, content authentication, deepfake detection"
What is AI Detection,what-is-ai-detection,ai-safety,done,1,"AI detection, AI content detection, plagiarism checker, AI writing detector, deepfake detector"
What is AI Regulation,what-is-ai-regulation,ai-safety,done,2,"AI regulation, AI law, AI policy, AI act, AI compliance"
What is AI Avatar,what-is-ai-avatar,ai-tools,done,2,"AI avatar, digital avatar, virtual avatar, AI character, AI profile picture"
What is AI Companion,what-is-ai-companion,ai-tools,done,2,"AI companion, AI friend, virtual companion, AI chatbot, Replika"
What is AI Search,what-is-ai-search,ai-tools,done,1,"AI search, AI-powered search, semantic search, intelligent search, search AI"
What is AI Summarizer,what-is-ai-summarizer,ai-tools,done,1,"AI summarizer, text summarization, AI summary, document summarizer, AI article summary"
What is AI Transcription,what-is-ai-transcription,ai-tools,done,1,"AI transcription, speech-to-text, automatic transcription, voice recognition, AI transcribe"
What is AI Photo Editing,what-is-ai-photo-editing,ai-tools,done,2,"AI photo editing, AI image editor, photo AI, automatic photo edit, AI enhancement"
What is AI Upscaling,what-is-ai-upscaling,ai-tools,done,2,"AI upscaling, image upscaling, AI upscale, resolution enhancement, AI image enhancer"
What is AI Background Removal,what-is-ai-background-removal,ai-tools,done,2,"AI background removal, background remover, image segmentation, remove background, AI photo editor"
What is Autonomous Vehicle AI,what-is-autonomous-vehicle-ai,ai-basics,failed,1,"autonomous vehicle, self-driving car, autonomous driving, AI car, driverless vehicle"
What is AI in Healthcare,what-is-ai-in-healthcare,ai-basics,done,1,"AI healthcare, medical AI, healthcare AI, AI diagnosis, AI medicine"
What is AI in Finance,what-is-ai-in-finance,ai-basics,done,2,"AI finance, fintech AI, AI trading, financial AI, AI banking"
What is AI in Education,what-is-ai-in-education,ai-basics,done,2,"AI education, EdTech, AI tutoring, AI learning, personalized learning"
What is AI in Gaming,what-is-ai-in-gaming,ai-basics,done,2,"AI gaming, game AI, NPC AI, AI game development, procedural generation"
What is AI Reasoning,what-is-ai-reasoning,ai-agents,done,1,"AI reasoning, logical reasoning, chain-of-thought, AI thinking, reasoning model"
What is AI Assistant,what-is-ai-assistant,ai-tools,done,1,"AI assistant, virtual assistant, AI helper, smart assistant, personal AI"
What is Anthropic,what-is-anthropic,ai-tools,done,1,"Anthropic, Claude AI, AI safety company, Claude Anthropic, responsible AI"
What is AI Startup,what-is-ai-startup,ai-basics,done,2,"AI startup, AI company, AI business, AI entrepreneurship, AI venture"
What is AI Winter,what-is-ai-winter,ai-basics,done,2,"AI winter, AI history, AI bubble, AI downturn, AI research history"
What is Artificial Superintelligence,what-is-artificial-superintelligence,ai-basics,failed,2,"superintelligence, artificial superintelligence, ASI, superhuman AI, AI beyond human"
What is AI Singularity,what-is-ai-singularity,ai-basics,failed,2,"AI singularity, technological singularity, superintelligence, future AI, AI explosion"
What is Artificial Intelligence,what-is-artificial-intelligence,ai-basics,done,1,"artificial intelligence, AI, machine intelligence, intelligent machine, AI definition"
What is Algorithm,what-is-algorithm,ai-basics,done,1,"algorithm, computer algorithm, step-by-step procedure, AI algorithm, computational thinking"
What is Augmented Reality AI,what-is-augmented-reality-ai,ai-tools,done,2,"augmented reality AI, AR AI, mixed reality, AI AR, augmented intelligence"
What is AI Bias,what-is-ai-bias,ai-safety,done,1,"AI bias, algorithmic bias, machine learning bias, AI fairness, biased AI"
What is AI Literacy,ai-literacy,ai-basics,done,2,"AI literacy, AI understanding, AI education, digital literacy, AI skills"
What is AI Fluency,ai-fluency,ai-basics,done,2,"AI fluency, AI competence, AI work skills, AI proficiency, AI capability"
What is AI Augmentation,ai-augmentation,ai-basics,failed,2,"AI augmentation, human AI collaboration, augmented intelligence, AI assistance, intelligence amplification"
What is AI in Agriculture,ai-in-agriculture,ai-basics,done,2,"AI agriculture, precision farming, smart farming, crop AI, agri-tech"
What is AI in Cybersecurity,ai-in-cybersecurity,ai-basics,done,2,"AI cybersecurity, security AI, threat detection, cyber defense, AI security"
What is AI in Manufacturing,ai-in-manufacturing,ai-basics,failed,2,"AI manufacturing, smart manufacturing, industry 4.0, factory AI, industrial AI"
What is AI in Supply Chain,ai-in-supply-chain,ai-basics,done,2,"AI supply chain, logistics AI, supply chain optimization, demand forecasting, inventory AI"
What is AI in Retail,ai-in-retail,ai-basics,done,2,"AI retail, retail analytics, smart retail, e-commerce AI, personalized shopping"
What is AI in Marketing,ai-in-marketing,ai-basics,done,2,"AI marketing, marketing automation, AI advertising, digital marketing, predictive marketing"
What is AI in Human Resources,ai-in-human-resources,ai-basics,done,2,"AI HR, HR automation, talent AI, recruitment AI, people analytics"
What is AI in Real Estate,ai-in-real-estate,ai-basics,done,2,"AI real estate, property AI, real estate analytics, smart property, proptech"
What is AI in Insurance,ai-in-insurance,ai-basics,failed,2,"AI insurance, insurtech, claims AI, underwriting AI, insurance analytics"
What is AI in Energy,ai-in-energy,ai-basics,failed,2,"AI energy, smart grid, energy optimization, renewable AI, energy efficiency"
What is AI in Transportation,ai-in-transportation,ai-basics,failed,2,"AI transportation, smart transportation, traffic AI, logistics AI, mobility AI"
What is AI in Sports,ai-in-sports,ai-basics,done,2,"AI sports, sports analytics, athlete performance, sports technology, game analysis"
What is AI in Law,ai-in-law,ai-basics,done,2,"AI law, legal AI, legal technology, AI legal, legal analytics"
What is AI in Government,ai-in-government,ai-basics,done,2,"AI government, smart government, public sector AI, civic AI, e-government"
What is AI in Construction,ai-in-construction,ai-basics,done,2,"AI construction, smart construction, construction tech, building AI, project AI"
What is AI in Telecommunications,ai-in-telecommunications,ai-basics,failed,2,"AI telecom, network AI, telecom analytics, 5G AI, communication AI"
What is AI in Social Media,ai-in-social-media,ai-basics,done,2,"AI social media, social media AI, content moderation, recommendation AI, social analytics"
What is AI in Environmental Science,ai-in-environmental-science,ai-basics,done,2,"AI environment, climate AI, environmental monitoring, sustainability AI, green AI"
What is Aleatoric Uncertainty,what-is-aleatoric-uncertainty,ai-basics,done,2,"aleatoric uncertainty, data uncertainty, irreducible uncertainty, random noise, inherent variability"
What is API Endpoint,what-is-api-endpoint,llms,failed,2,"API endpoint, API URL, REST endpoint, API call, API integration"
What is API Key,what-is-api-key,llms,done,2,"API key, authentication, API access, API token, developer key"
What is AI Model Hallucination,what-is-ai-model-hallucination,llms,failed,2,"model hallucination, AI hallucination, false information, LLM error, AI fabrication"
What is Autoregressive Model,what-is-autoregressive-model,llms,done,2,"autoregressive, sequential generation, next token, left-to-right, causal LM"
What is Attention Head,what-is-attention-head,llms,failed,2,"attention head, multi-head attention, parallel attention, transformer component, attention mechanism"
What is Agent Architecture,what-is-agent-architecture,ai-agents,failed,2,"agent architecture, agent design, AI agent structure, agent system, agent framework"
What is Agent Framework,what-is-agent-framework,ai-agents,done,2,"agent framework, AI agent framework, LangChain, CrewAI, agent development"
What is Agent Loop,what-is-agent-loop,ai-agents,done,2,"agent loop, agent cycle, observe think act, agent iteration, reasoning loop"
What is Agent Orchestration,what-is-agent-orchestration,ai-agents,failed,2,"agent orchestration, multi-agent, agent coordination, agent management, workflow orchestration"
What is Agent Safety,what-is-agent-safety,ai-agents,done,2,"agent safety, safe agents, AI agent safety, guardrails, agent boundaries"
What is Agent Evaluation,what-is-agent-evaluation,ai-agents,done,2,"agent evaluation, agent testing, agent benchmark, agent performance, agent metrics"
What is Agent Memory,what-is-agent-memory,ai-agents,failed,2,"agent memory, memory system, short-term memory, long-term memory, agent context"
What is Agent Tool Use,what-is-agent-tool-use,ai-agents,failed,2,"tool use, AI tool, function calling, agent tools, tool integration"
What is Autonomous Agent,what-is-autonomous-agent,ai-agents,done,2,"autonomous agent, self-directed AI, independent agent, auto agent, AI autonomy"
What is Action Model,what-is-action-model,ai-agents,done,2,"action model, AI action, agent action, action space, action selection"
What is Adaptive Agent,what-is-adaptive-agent,ai-agents,done,2,"adaptive agent, learning agent, adapting AI, flexible agent, self-improving"
What is Assistant Message,what-is-assistant-message,prompt-engineering,done,2,"assistant message, AI response, model output, assistant reply, chat response"
What is A-B Prompt Testing,what-is-a-b-prompt-testing,prompt-engineering,done,2,"A/B testing, prompt comparison, version test, prompt evaluation, prompt experiment"
What is Adobe Firefly,what-is-adobe-firefly,ai-tools,done,2,"Adobe Firefly, generative AI, Adobe AI, image generation, creative AI"
What is AIVA AI,what-is-aiva-ai,ai-tools,failed,2,"AIVA, AI composer, classical music, music AI, composition AI"
What is AI21 Labs,what-is-ai21-labs,ai-tools,failed,2,"AI21 Labs, Jurassic, AI21, language model, NLP AI"
What is Apollo AI,what-is-apollo-ai,ai-tools,failed,2,"Apollo, sales AI, lead generation, sales platform, prospect AI"
What is AWS SageMaker,what-is-aws-sagemaker,ai-infrastructure,failed,2,"SageMaker, AWS AI, ML platform, Amazon AI, model training"
What is Azure AI,what-is-azure-ai,ai-infrastructure,failed,2,"Azure AI, Microsoft AI, Azure ML, AI platform, cloud AI"
What is Anyscale,what-is-anyscale,ai-infrastructure,failed,2,"Anyscale, Ray, distributed computing, AI scaling, ML infrastructure"
What is A/B Testing in ML,what-is-a-b-testing-in-ml,ai-infrastructure,done,2,"A/B testing, model comparison, experiment, champion challenger, ML evaluation"
What is AI Gateway,what-is-ai-gateway,ai-infrastructure,failed,2,"AI gateway, API gateway, LLM gateway, proxy, rate limiting"
What is AI Observability,what-is-ai-observability,ai-infrastructure,done,2,"AI observability, model observability, monitoring, tracing, AI insights"
What is AI Transparency,what-is-ai-transparency,ai-safety,done,2,"AI transparency, transparent AI, explainable, open AI, visible AI"
What is AI Accountability,what-is-ai-accountability,ai-safety,done,2,"AI accountability, responsible AI, answerability, AI responsibility, governance"
What is AI Fairness,what-is-ai-fairness,ai-safety,done,2,"AI fairness, fair AI, unbiased AI, equal treatment, anti-discrimination"
What is AI Robustness,what-is-ai-robustness,ai-safety,failed,2,"AI robustness, robust AI, reliable AI, stable AI, failure resistance"
What is AI Red Teaming,what-is-ai-red-teaming,ai-safety,done,2,"red team, AI red team, security testing, adversarial testing, AI security audit"
What is AI Auditing,what-is-ai-auditing,ai-safety,done,2,"AI audit, AI auditing, model audit, compliance check, AI review"
What is AI Risk Assessment,what-is-ai-risk-assessment,ai-safety,done,2,"AI risk, risk assessment, AI hazard, risk analysis, risk management"
What is Adversarial Attack,what-is-adversarial-attack,ai-safety,failed,2,"adversarial attack, evasion attack, input manipulation, fool AI, adversarial example"
What is Adversarial Example,what-is-adversarial-example,ai-safety,failed,2,"adversarial example, adversarial input, attack sample, manipulated input, perturbation"
What is AI Ethics Committee,what-is-ai-ethics-committee,ai-safety,done,2,"AI ethics, ethics committee, AI governance, oversight, ethics board"
What is AI Impact Assessment,what-is-ai-impact-assessment,ai-safety,pending,2,"AI impact, impact assessment, AI effect, social impact, risk evaluation"
What is Algorithmic Fairness,what-is-algorithmic-fairness,ai-safety,pending,2,"algorithmic fairness, fair algorithm, unbiased, equality, fairness metric"
What is AI Bias Detection,what-is-ai-bias-detection,ai-safety,pending,2,"bias detection, bias identification, unfairness detection, discrimination, bias tool"
What is AI Bias Mitigation,what-is-ai-bias-mitigation,ai-safety,pending,2,"bias mitigation, reduce bias, debias, fairness intervention, bias correction"
What is AI Misuse Prevention,what-is-ai-misuse-prevention,ai-safety,pending,2,"misuse prevention, AI abuse, prevent harm, misuse detection, security"
What is AI Hallucination Prevention,what-is-ai-hallucination-prevention,ai-safety,pending,2,"hallucination prevention, factual accuracy, grounding, reduce hallucination, truthfulness"
What is AI Watermark Detection,what-is-ai-watermark-detection,ai-safety,pending,2,"watermark detection, AI watermark, content authentication, AI detection, synthetic detection"
What is AI Provenance,what-is-ai-provenance,ai-safety,pending,2,"AI provenance, content origin, AI history, content source, origin tracking"
What is AI Compliance,what-is-ai-compliance,ai-safety,pending,2,"AI compliance, regulatory compliance, AI regulation, legal compliance, AI standards"
What is AI Act,what-is-ai-act,ai-safety,pending,2,"AI Act, EU AI Act, AI regulation, AI law, European AI"
What is AI Privacy,what-is-ai-privacy,ai-safety,pending,2,"AI privacy, data privacy, privacy protection, personal data, privacy AI"
What is AI and Copyright,what-is-ai-and-copyright,ai-safety,pending,2,"AI copyright, copyright law, AI content, intellectual property, AI ownership"
What is AI Consent,what-is-ai-consent,ai-safety,pending,2,"AI consent, user consent, data consent, permission, opt-in"
What is AI-Assisted Development,what-is-ai-assisted-development,ai-coding,pending,2,"AI assisted, AI development, coding with AI, AI pair programmer, assisted coding"
What is AI Code Review,what-is-ai-code-review,ai-coding,pending,2,"AI code review, automated review, code quality, bug detection, review AI"
What is AI Code Testing,what-is-ai-code-testing,ai-coding,pending,2,"AI testing, test generation, unit test AI, automated testing, test AI"
What is AI Code Refactoring,what-is-ai-code-refactoring,ai-coding,pending,2,"AI refactoring, code refactor, automated refactor, code improvement, AI cleanup"
What is AI Code Documentation,what-is-ai-code-documentation,ai-coding,pending,2,"AI documentation, code docs, docstring, automated docs, documentation AI"
What is AI Debugging,what-is-ai-debugging,ai-coding,pending,2,"AI debugging, debug assistant, bug finder, error detection, debug AI"
What is AI Code Migration,what-is-ai-code-migration,ai-coding,pending,2,"code migration, language migration, code conversion, AI migration, code transform"
What is AI Code Explanation,what-is-ai-code-explanation,ai-coding,pending,2,"code explanation, explain code, code reader, AI explainer, code understanding"
What is AI Code Generation for Functions,what-is-ai-code-generation-for-functions,ai-coding,pending,2,"function generation, code function, API code, auto function, AI function"
What is AI Code Generation for Tests,what-is-ai-code-generation-for-tests,ai-coding,pending,2,"test generation, unit test, test case, automated test, AI test"
What is AI Scripting,what-is-ai-scripting,ai-coding,pending,2,"AI scripting, script generation, automation script, task script, AI automation"
What is AI SQL Generation,what-is-ai-sql-generation,ai-coding,pending,2,"AI SQL, query generation, database query, SQL AI, natural language SQL"
What is AI Regex Generation,what-is-ai-regex-generation,ai-coding,pending,2,"AI regex, regex generation, pattern generation, regular expression, regex AI"
What is AI Code Completion,what-is-ai-code-completion,ai-coding,pending,2,"code completion, autocomplete, AI autocomplete, inline suggestion, code prediction"
What is AI Pair Programming,what-is-ai-pair-programming,ai-coding,pending,2,"pair programming, AI pair, coding partner, collaborative coding, pair AI"
What is AI Terminal Assistant,what-is-ai-terminal-assistant,ai-coding,pending,2,"terminal AI, command line, shell AI, CLI assistant, terminal helper"
What is AI Pull Request Review,what-is-ai-pull-request-review,ai-coding,pending,2,"PR review, pull request, code review, automated review, AI PR"
What is AI Commit Message,what-is-ai-commit-message,ai-coding,pending,2,"commit message, git commit, AI commit, automated commit, commit generation"
What is AI Code Security Scan,what-is-ai-code-security-scan,ai-coding,pending,2,"code security, vulnerability scan, security scan, AI security, code audit"
What is AI Dependency Management,what-is-ai-dependency-management,ai-coding,pending,2,"dependency AI, package management, dependency update, AI dependency, dependency check"
What is AI Dev Environment,what-is-ai-dev-environment,ai-coding,pending,2,"AI dev environment, development environment, AI IDE, cloud dev, dev setup"
What is AI Code Snippet,what-is-ai-code-snippet,ai-coding,pending,2,"code snippet, snippet generation, code example, AI snippet, reusable code"
What is AI API Integration,what-is-ai-api-integration,ai-coding,pending,2,"API integration, API AI, connect API, API development, AI API code"
What is AI Code Template,what-is-ai-code-template,ai-coding,pending,2,"code template, template generation, boilerplate, starter code, AI template"
What is AI Full-Stack Development,what-is-ai-full-stack-development,ai-coding,pending,2,"full-stack AI, frontend backend, AI full-stack, app development, web AI"
What is AI No-Code Development,what-is-ai-no-code-development,ai-coding,pending,2,"no-code, no code, low-code, visual development, AI builder"
What is AI Agent for Coding,what-is-ai-agent-for-coding,ai-coding,pending,2,"coding agent, autonomous coder, AI dev agent, software agent, code AI"
What is AI Application Builder,what-is-ai-application-builder,ai-coding,pending,2,"app builder, application generator, AI builder, app creation, software builder"
What is AI Prototype Generator,what-is-ai-prototype-generator,ai-coding,pending,2,"prototype generation, MVP AI, rapid prototyping, quick build, AI prototype"
What is Accent Recognition,what-is-accent-recognition,ai-voice,pending,2,"accent recognition, accent detection, dialect, speech variation, accent AI"
What is AI Art,what-is-ai-art,ai-creative,pending,2,"AI art, AI artwork, generative art, AI creativity, digital art"
What is AI Design,what-is-ai-design,ai-creative,pending,2,"AI design, generative design, design AI, creative design, automated design"
What is AI Animation,what-is-ai-animation,ai-creative,pending,2,"AI animation, animation AI, AI motion, auto animate, AI video"
What is AI 3D Modeling,what-is-ai-3d-modeling,ai-creative,pending,2,"AI 3D, 3D modeling, 3D generation, 3D AI, 3D creation"
What is AI Video Editing,what-is-ai-video-editing,ai-creative,pending,2,"AI video editor, video editing, automated edit, AI video tool, video AI"
What is AI Photo Enhancement,what-is-ai-photo-enhancement,ai-creative,pending,2,"photo enhancement, AI photo, image improvement, photo editing, AI enhancement"
What is AI Colorization,what-is-ai-colorization,ai-creative,pending,2,"AI colorization, colorize, black and white, image color, auto color"
What is AI Image Restoration,what-is-ai-image-restoration,ai-creative,pending,2,"image restoration, photo restoration, fix old photo, AI repair, restore image"
What is AI Style Transfer,what-is-ai-style-transfer,ai-creative,pending,2,"style transfer, artistic style, image style, neural style, AI art style"
What is AI Graphic Design,what-is-ai-graphic-design,ai-creative,pending,2,"AI graphic design, graphic AI, design automation, visual design, AI designer"
What is AI Logo Design,what-is-ai-logo-design,ai-creative,pending,2,"AI logo, logo generator, logo AI, brand design, logo maker"
What is AI Thumbnail Generator,what-is-ai-thumbnail-generator,ai-creative,pending,2,"AI thumbnail, thumbnail generator, YouTube thumbnail, video thumbnail, thumbnail AI"
What is AI Music Composition,what-is-ai-music-composition,ai-creative,pending,2,"AI music, music composition, AI composer, music generation, AI song"
What is AI Audio Processing,what-is-ai-audio-processing,ai-creative,pending,2,"AI audio, audio processing, sound AI, audio enhancement, audio tool"
What is AI Sound Design,what-is-ai-sound-design,ai-creative,pending,2,"AI sound, sound design, audio design, sound effects, AI audio"
What is AI Meme Generator,what-is-ai-meme-generator,ai-creative,pending,2,"AI meme, meme generator, meme AI, viral image, humor AI"
What is AI Story Generator,what-is-ai-story-generator,ai-creative,pending,2,"AI story, story generator, creative writing, narrative AI, fiction AI"
What is AI Script Writing,what-is-ai-script-writing,ai-creative,pending,2,"AI script, script writing, screenplay, video script, dialogue AI"
What is AI Poetry,what-is-ai-poetry,ai-creative,pending,2,"AI poetry, poem generator, poetry AI, creative writing, verse AI"
What is AI Fashion Design,what-is-ai-fashion-design,ai-creative,pending,2,"AI fashion, fashion design, clothing AI, style AI, fashion technology"
What is AI Interior Design,what-is-ai-interior-design,ai-creative,pending,2,"AI interior, interior design, room design, home AI, design AI"
